{
  "schema_version": "0.1.0",
  "receipt_id": "consent-reproducibility-snapshot-001",
  "created_at": "2026-06-30T14:00:00Z",
  "notice_version": "example-notice-0.1.0",
  "controller": {
    "name": "opendata4all example fixtures",
    "contact": "privacy@example.invalid",
    "jurisdiction": "example"
  },
  "source_scope": {
    "sources": [
      "manual synthetic reproducibility snapshot fixture"
    ],
    "adapters": [
      {
        "name": "od4a-reproducibility-snapshot-example",
        "version": "0.1.0",
        "capture_method": "manual_import"
      }
    ],
    "project_scope": [
      "examples/reproducibility-snapshot-package"
    ],
    "time_scope": {
      "mode": "fixed_range",
      "from": "2026-06-30T14:00:00Z",
      "to": "2026-06-30T14:05:00Z"
    }
  },
  "data_classes": [
    "synthetic_user_prompt",
    "synthetic_assistant_response"
  ],
  "purposes": [
    "schema_validation_fixture",
    "reproducibility_documentation"
  ],
  "recipient_classes": [
    "public"
  ],
  "release_tier": "reproducibility_snapshot",
  "redaction_policy_version": "example-redaction-0.1.0",
  "package_manifest_hash": "sha256:a1d34886fa73cb7f608c0ba4bab2c34ec5c51718a650b7bcd1c5bf8c13d92296",
  "retention": {
    "class": "fixed_period",
    "expires_at": "2027-06-30T14:00:00Z"
  },
  "withdrawal": {
    "method": "email",
    "email": "privacy@example.invalid"
  },
  "status": "active"
}
