{
  "schema_version": "0.1.0",
  "receipt_id": "consent-public-safe-conversation-001",
  "created_at": "2026-06-30T12:00:00Z",
  "notice_version": "example-notice-0.1.0",
  "controller": {
    "name": "opendata4all example fixtures",
    "contact": "privacy@example.invalid",
    "jurisdiction": "example"
  },
  "source_scope": {
    "sources": [
      "manual synthetic conversation fixture"
    ],
    "adapters": [
      {
        "name": "od4a-public-safe-conversation-example",
        "version": "0.1.0",
        "capture_method": "manual_import"
      }
    ],
    "project_scope": [
      "examples/public-safe-conversation-package"
    ],
    "time_scope": {
      "mode": "fixed_range",
      "from": "2026-06-30T12:00:00Z",
      "to": "2026-06-30T12:05:00Z"
    }
  },
  "data_classes": [
    "synthetic_user_prompt",
    "synthetic_assistant_response"
  ],
  "purposes": [
    "schema_validation_fixture",
    "public_documentation"
  ],
  "recipient_classes": [
    "public"
  ],
  "release_tier": "public_release",
  "redaction_policy_version": "example-redaction-0.1.0",
  "package_manifest_hash": "sha256:6a87a790231c3845431eb2860f14f27fc5ea28007a08191647a379923541431e",
  "retention": {
    "class": "fixed_period",
    "expires_at": "2027-06-30T12:00:00Z"
  },
  "withdrawal": {
    "method": "email",
    "email": "privacy@example.invalid"
  },
  "status": "active"
}
