{
  "schema_version": "0.1.0",
  "receipt_id": "consent-controlled-research-001",
  "created_at": "2026-06-30T13:00:00Z",
  "notice_version": "example-notice-0.1.0",
  "controller": {
    "name": "opendata4all example fixtures",
    "contact": "privacy@example.invalid",
    "jurisdiction": "example"
  },
  "source_scope": {
    "sources": [
      "manual synthetic controlled research fixture"
    ],
    "adapters": [
      {
        "name": "od4a-controlled-research-example",
        "version": "0.1.0",
        "capture_method": "manual_import"
      }
    ],
    "project_scope": [
      "examples/controlled-research-package"
    ],
    "time_scope": {
      "mode": "fixed_range",
      "from": "2026-06-30T13:00:00Z",
      "to": "2026-06-30T13:05:00Z"
    }
  },
  "data_classes": [
    "synthetic_user_prompt",
    "synthetic_assistant_response"
  ],
  "purposes": [
    "schema_validation_fixture",
    "controlled_research_documentation"
  ],
  "recipient_classes": [
    "approved_researchers",
    "data_access_committee"
  ],
  "release_tier": "controlled_research",
  "redaction_policy_version": "example-redaction-0.1.0",
  "package_manifest_hash": "sha256:db022c7bab18ca568318f04361eb79e79d37bc2261b5719646fc803a6cc44210",
  "retention": {
    "class": "fixed_period",
    "expires_at": "2027-06-30T13:00:00Z"
  },
  "withdrawal": {
    "method": "email",
    "email": "privacy@example.invalid"
  },
  "status": "active"
}
